id,user_id,query_text,response_text,sources,response_time_ms,feedback_score,created_at
308c8f62-0bcc-41e1-b349-f8ab4a876e2c,,what is a loan,"Based on the provided context documents, a loan is not explicitly defined. However, the context documents provide information on various aspects of loans, such as Loan to Value (LTV) ratios, fixed rates, conditions, and charges.

From Document 1 (regulatory_manual), we can infer that a loan is a financial product that involves borrowing money, as it mentions ""Loan to Value"" and ""Large Loans."" Additionally, Document 1 states that Buy-to-Let loans over £2 million are not available, which suggests that loans are used for specific purposes, such as purchasing a property.

Document 2 (regulatory_manual) explains fixed rates, which are a type of interest rate that remains the same during the fixed period of the loan. This implies that a loan has an interest rate associated with it and that the borrower is required to make monthly repayments.

Document 3 (regulatory_manual) outlines the conditions and charges associated with a mortgage, which is a type of loan. It states that a first charge over the property is required as security and that full personal guarantees are required from all directors/shareholders of a SPV Limited Company or all members of a LLP.

Document 4 (regulatory_manual) provides information on the Loan to Value (LTV) ratio, which is the percentage of the property's value that can be borrowed. It states that loans can only be used to purchase a residential property with a mortgage loan size that is over 90% of the property price or value up to a maximum of 100% whichever is the lower.

Document 5 (regulatory_manual) provides general information on mortgages, which are a type of loan. It states that mortgages are subject to status and valuation, and that a first charge over the property is required. It also mentions that the mortgage is available on an interest-only and/or repayment basis.

In summary, while the context documents do not provide a direct definition of a loan, they imply that a loan is a financial product that involves borrowing money, typically for a specific purpose such as purchasing a property, and is associated with an interest rate, monthly repayments, and certain conditions and charges.

As a loan officer, it is essential to note that the information provided is based on the context documents and may not be comprehensive or up-to-date. For regulatory or compliance matters, it is crucial to verify the information with current regulations and policies.","[{""document_id"":""7071751a-c3c4-4586-a41c-37da493416ad"",""chunk_content"":""LTV: Loan to Value, this is based on the lower of the purchase price or our valuation. Large Loans: Buy-to-Let loans over £2million are not available at present. This \nincludes rate switches on existi..."",""document_title"":""Unknown Document"",""confidence_score"":0.629794885759188},{""document_id"":""7071751a-c3c4-4586-a41c-37da493416ad"",""chunk_content"":""Fixed Rates explained \nA fixed rate provides an interest rate that remains the same during the fixed period of the loan. After the fixed period of your loan our fixed rates revert to Bank of England \n..."",""document_title"":""Unknown Document"",""confidence_score"":0.58861829604561},{""document_id"":""7071751a-c3c4-4586-a41c-37da493416ad"",""chunk_content"":""Condition & Charges:  A first charge over the property will be required as security for our mortgage. Full Personal Guarantees are required from all directors/ shareholders of a SPV \nLimited Company. ..."",""document_title"":""Unknown Document"",""confidence_score"":0.580713195183482},{""document_id"":""7071751a-c3c4-4586-a41c-37da493416ad"",""chunk_content"":""These products can only be used to purchase a residential property with a mortgage loan size that is over 90% of the property price or value up to a maximum of 100% whichever is \nthe lower and cannot ..."",""document_title"":""Unknown Document"",""confidence_score"":0.576854635912194},{""document_id"":""7071751a-c3c4-4586-a41c-37da493416ad"",""chunk_content"":""You are strongly recommended to have life assurance in place to cover the full amount of all sums that you may borrow from us under the facility. Applications are subject \nto status and a minimum age ..."",""document_title"":""Unknown Document"",""confidence_score"":0.568811347726405}]",1619,,2025-07-19 20:12:39.708
43607349-4136-4d5b-b582-d54e7900e8bf,,What is the minimum and maximum loan amount for Premier Exclusive products?,"According to the provided context documents, specifically Document 1 (regulatory_manual) and Document 2 (regulatory_manual), the minimum and maximum loan amounts for Premier Exclusive products are as follows:

- Minimum Loan: £5k
- Maximum Loan: £2m

This information is consistent across multiple documents, including Document 1, Document 2, and other regulatory manuals. However, it's essential to note that these loan amounts might be subject to change, and it's crucial to verify this information with the most current regulatory manuals or documentation.

For Premier Exclusive 5 Year Fixed Rate products, Document 3 (regulatory_manual) and Document 4 (regulatory_manual) also mention the same minimum loan amount of £5k. However, the maximum loan amount varies for certain products, such as the Premier Exclusive 5 Year Fixed Rate (until 30/09/2030) with a maximum loan of £640k for 90% LTV.

To ensure compliance with current regulations and internal policies, I recommend verifying this information with the latest regulatory manuals, specifically sections related to loan products and underwriting requirements. As stated in the context documents, customers must hold a Wealth / Premier Banking relationship with Barclays to apply for these products and qualify for retail underwriting.

In summary, the minimum and maximum loan amounts for Premier Exclusive products are £5k and £2m, respectively. Nevertheless, it's crucial to consult the most recent regulatory manuals and documentation to confirm this information and ensure compliance with current regulations and internal policies.","[{""document_id"":""7071751a-c3c4-4586-a41c-37da493416ad"",""chunk_content"":""Premier Exclusive 2 Year Fixed Rate (until \n30/09/2027) \nMinimum Loan £5k   \nMaximum Loan £2m..."",""document_title"":""Unknown Document"",""confidence_score"":0.810153856314154},{""document_id"":""7071751a-c3c4-4586-a41c-37da493416ad"",""chunk_content"":""2 Year Fixed Products  \nPremier Exclusive Rates - Customers must hold a Wealth / Premier Banking relationship with Barclays to apply for these products and qualify for retail underwriting \nProduct Typ..."",""document_title"":""Unknown Document"",""confidence_score"":0.788336298764284},{""document_id"":""7071751a-c3c4-4586-a41c-37da493416ad"",""chunk_content"":""and qualify for retail underwriting \nProduct Type \nMinimum/Maxim\num Loan size \nInitial \nInterest \nRate \nFollow on rate \nThe Overall Cost \nfor Comparison  \nProduct \nFee \nLTV \nEarly \nRepayment \nCharge \n..."",""document_title"":""Unknown Document"",""confidence_score"":0.781307531517308},{""document_id"":""7071751a-c3c4-4586-a41c-37da493416ad"",""chunk_content"":""4.03% \n5.5% APRC £899 75% \n4.14% \n5.5% APRC £0 \n75% \n4.21% \n5.6% APRC £899 \n85% \n4.29% \n5.6% APRC £0 \n85% \nPremier Exclusive 5 Year Fixed Rate (until \n30/09/2030) \nMinimum Loan £5k        \nMaximum Loa..."",""document_title"":""Unknown Document"",""confidence_score"":0.780867796254584},{""document_id"":""7071751a-c3c4-4586-a41c-37da493416ad"",""chunk_content"":""999 85% \n \n3 Year Fixed Products  \nPremier Exclusive Rates - Customers must hold a Wealth / Premier Banking relationship with Barclays to apply for these products and qualify for retail underwriting \n..."",""document_title"":""Unknown Document"",""confidence_score"":0.773727590149073}]",1673,,2025-07-19 20:51:02.143
5698cae4-181c-414b-a2d3-4fd95cd2031e,,can i take loan?,"To determine if you can take a loan, we need to consider the information provided in the context documents. 

According to Document 1 (regulatory_manual), applications are subject to status and a minimum age of 18. Additionally, it states that ""The minimum age for taking out a mortgage with Barclays is 18. Usually the maximum age at the end of the mortgage term should be 70 or your retirement age – whichever is sooner.""

Since your question is about taking a loan, I must clarify that the context documents primarily discuss mortgage products. However, to provide a general answer, I will outline the key points:

1. **Age Requirement**: You must be at least 18 years old to apply for a loan (as per Document 1).
2. **Loan Products**: The context documents mention specific mortgage products, such as the Premier Exclusive 2 Year Fixed Rate and 3 Year Fixed Rate (Documents 3 and 4). However, these products have specific requirements, like a minimum loan amount of £5,000 and a maximum loan amount of £2,000,000.
3. **Regulatory Compliance**: It is essential to note that loan applications are subject to status and regulatory compliance. As stated in Document 1, ""Applications are subject to status and a minimum age of 18.""
4. **Loan-to-Value (LTV) Ratio**: Document 5 mentions that certain products can only be used to purchase a residential property with a mortgage loan size that is over 90% of the property price or value up to a maximum of 100% whichever is the lower.

To proceed with your loan application, I would need more information about your specific situation, such as your age, loan amount, and purpose of the loan. Additionally, please note that regulatory requirements and loan products are subject to change, and it is crucial to verify the current rates and terms.

As of the current date (7/20/2025), the rates and terms mentioned in the context documents may not be up-to-date. I recommend verifying the current rates and terms with our institution to ensure accuracy.

In summary, while I can provide general guidance, I would need more information to determine your eligibility for a loan. I strongly advise consulting the relevant regulatory manuals and seeking current verification of rates and terms before proceeding with a loan application.","[{""document_id"":""7071751a-c3c4-4586-a41c-37da493416ad"",""chunk_content"":""You are strongly recommended to have life assurance in place to cover the full amount of all sums that you may borrow from us under the facility. Applications are subject \nto status and a minimum age ..."",""document_title"":""Unknown Document"",""confidence_score"":0.610337338260149},{""document_id"":""7071751a-c3c4-4586-a41c-37da493416ad"",""chunk_content"":""ere the end of term date of the mortgage would be later than this for any applicant, applications may still be considered on an individual basis. Mortgages are \nnot available for business purposes.  \n..."",""document_title"":""Unknown Document"",""confidence_score"":0.583388040469651},{""document_id"":""7071751a-c3c4-4586-a41c-37da493416ad"",""chunk_content"":""er Banking relationship with Barclays to apply for these products and qualify for retail underwriting \n \nPremier Exclusive 2 Year Fixed Rate (until \n30/09/2027) \nMinimum Loan £5k   \nMaximum Loan £2m \n..."",""document_title"":""Unknown Document"",""confidence_score"":0.583108380477148},{""document_id"":""7071751a-c3c4-4586-a41c-37da493416ad"",""chunk_content"":""999 85% \n \n3 Year Fixed Products  \nPremier Exclusive Rates - Customers must hold a Wealth / Premier Banking relationship with Barclays to apply for these products and qualify for retail underwriting \n..."",""document_title"":""Unknown Document"",""confidence_score"":0.575351458704161},{""document_id"":""7071751a-c3c4-4586-a41c-37da493416ad"",""chunk_content"":""These products can only be used to purchase a residential property with a mortgage loan size that is over 90% of the property price or value up to a maximum of 100% whichever is \nthe lower and cannot ..."",""document_title"":""Unknown Document"",""confidence_score"":0.573815651590978}]",2181,,2025-07-19 20:12:02.059
5ed1bb42-044c-4d2e-8bfc-4af6a63f9a52,,Are mortgages available for business purposes?,"According to the provided context documents, specifically Document 1 (regulatory_manual) and Document 3 (regulatory_manual), mortgages are not available for business purposes. 

As stated in Document 1: ""Mortgages are not available for business purposes.""

Additionally, Document 3 reiterates this policy: ""Mortgages are not available for business purposes.""

It is essential to note that these documents are part of the regulatory manual, and as such, they outline the policies and guidelines for mortgage products. However, for the most current and accurate information, I recommend verifying this information with the latest regulatory updates and internal policies, as regulations and policies may change over time.

In this case, since the information is clearly stated in the provided context documents, I can confirm that, as per the available data, mortgages are not available for business purposes. Nevertheless, for any specific or detailed inquiries, especially regarding regulatory compliance, it is crucial to consult the most recent versions of the regulatory manuals and seek verification from current sources.","[{""document_id"":""7071751a-c3c4-4586-a41c-37da493416ad"",""chunk_content"":""ere the end of term date of the mortgage would be later than this for any applicant, applications may still be considered on an individual basis. Mortgages are \nnot available for business purposes.  \n..."",""document_title"":""Unknown Document"",""confidence_score"":0.704257256553876},{""document_id"":""7071751a-c3c4-4586-a41c-37da493416ad"",""chunk_content"":""These products can only be used to purchase a residential property with a mortgage loan size that is over 90% of the property price or value up to a maximum of 100% whichever is \nthe lower and cannot ..."",""document_title"":""Unknown Document"",""confidence_score"":0.667525013083292},{""document_id"":""7071751a-c3c4-4586-a41c-37da493416ad"",""chunk_content"":""You are strongly recommended to have life assurance in place to cover the full amount of all sums that you may borrow from us under the facility. Applications are subject \nto status and a minimum age ..."",""document_title"":""Unknown Document"",""confidence_score"":0.645477068162028},{""document_id"":""7071751a-c3c4-4586-a41c-37da493416ad"",""chunk_content"":""Barclays Green Home BTL Mortgages \nThese products can only be used to purchase a new build residential property with an Energy Efficiency Rating of 81 or higher, or an Energy Efficiency Band of A or \n..."",""document_title"":""Unknown Document"",""confidence_score"":0.639553308486957},{""document_id"":""7071751a-c3c4-4586-a41c-37da493416ad"",""chunk_content"":""vices Register No. 759676). Registered in England. Registered No. 9740322 Registered Office: 1 Churchill Place, London E14 5HP. \n. \n \n \nPage 8 of 8 \n \n \nFeatures of our Buy to Let Mortgage Products: \n..."",""document_title"":""Unknown Document"",""confidence_score"":0.63516665834685}]",1700,,2025-07-19 20:51:00.382
b65a3262-6ab0-420f-9ae6-8725e5bc061e,,what are the interest rates for fixed rate mortgages?,"Based on the provided context documents, specifically Document 1 (regulatory_manual), fixed rates for mortgages are explained as providing an interest rate that remains the same during the fixed period of the loan. After the fixed period, the rates revert to the Bank of England Base Rate plus a margin.

However, the exact interest rates for fixed rate mortgages are not explicitly stated in the provided documents, except for an example given in Document 4 (regulatory_manual). This document mentions a fixed rate of 4.54% for 3 years. It's crucial to note that this is just an example and may not represent all fixed rate mortgage products or their current interest rates.

For the most up-to-date rates, Document 3 (regulatory_manual) advises speaking to mortgage advisers for full details. This suggests that current interest rates may have changed and are not reflected in the provided documents.

It's also important to consider the Early Repayment Charge (ERC) associated with fixed rate mortgages, as outlined in Documents 1, 3, and 5 (regulatory_manual). During an ERC period, capital reductions within a set allowance (25% for Premier exclusive fixed rates and 10% for all other fixed rates, per annum) can be made without incurring the charge.

To summarize:
- The fixed rate for the example given is 4.54% for 3 years.
- After the fixed period, the rate reverts to the Bank of England Base Rate (currently 4.25%, as per Document 3) plus a margin.
- For current and specific fixed rate mortgage interest rates, it's recommended to consult with mortgage advisers.
- Early Repayment Charges and allowances apply during certain periods, as detailed in the regulatory manuals.

References:
- Document 1 (regulatory_manual): Fixed Rates explanation
- Document 3 (regulatory_manual): Up-to-date rates and Bank of England Base Rate
- Document 4 (regulatory_manual): Example of a fixed rate mortgage
- Document 5 (regulatory_manual): Early Repayment Charge allowances

Please verify current rates and conditions with our mortgage advisers, as the information provided is based on the context documents and may not reflect the most current data.","[{""document_id"":""7071751a-c3c4-4586-a41c-37da493416ad"",""chunk_content"":""Fixed Rates explained \nA fixed rate provides an interest rate that remains the same during the fixed period of the loan. After the fixed period of your loan our fixed rates revert to Bank of England \n..."",""document_title"":""Unknown Document"",""confidence_score"":0.745942905787058},{""document_id"":""7071751a-c3c4-4586-a41c-37da493416ad"",""chunk_content"":""Tracker Rates explained \nAll Base Rate Trackers are linked to Bank of England Base Rate; \nAs the rate is linked to a variable rate, your monthly repayments may increase as well as decrease; \nThis is t..."",""document_title"":""Unknown Document"",""confidence_score"":0.694097967714688},{""document_id"":""7071751a-c3c4-4586-a41c-37da493416ad"",""chunk_content"":""st up to date rates available, please speak to our mortgage advisers for full details. \n \nThe Bank of England Base Rate (BEBR) is a variable rate set by the Bank of England. BEBR is currently 4.25%. \n..."",""document_title"":""Unknown Document"",""confidence_score"":0.688269876035457},{""document_id"":""7071751a-c3c4-4586-a41c-37da493416ad"",""chunk_content"":""A capital and interest mortgage of £198,000 payable over 300 months on a Fixed rate of 4.54% for 3 years and then our variable tracker rate of 1.99% above the \nBank of England Base Rate (currently 4.2..."",""document_title"":""Unknown Document"",""confidence_score"":0.678899705410008},{""document_id"":""7071751a-c3c4-4586-a41c-37da493416ad"",""chunk_content"":""During an early repayment charge period, capital reductions within a set allowance can be made without incurring the charge. The allowance for Premier \nexclusive fixed rates is 25% per annum (only app..."",""document_title"":""Unknown Document"",""confidence_score"":0.670866409436892}]",1652,,2025-07-19 20:12:20.203
b6b35388-303d-41ed-9f89-56d638e04cc9,,What is the minimum age requirement for a mortgage application?,"According to the provided context documents, specifically Document 1 (regulatory_manual) and Document 2 (regulatory_manual), the minimum age requirement for a mortgage application is 18 years old. This is stated in both documents as ""a minimum age of 18"" for the principal borrower.

To quote directly from Document 1: ""The minimum age for taking out a mortgage with Barclays is 18."" 

Additionally, Document 2 reinforces this by stating: ""All mortgages are subject to status and valuation and a minimum age of 18 for the principal borrower.""

It's essential to note that while these documents provide the minimum age requirement, they do not specify any maximum age limits for mortgage applications. However, Document 1 does mention that ""Usually the maximum age at the end of the mortgage term should be 70 or your retirement age – whichever is sooner,"" but this is not directly related to the application process itself.

For the most current and accurate information, I recommend verifying these requirements with the latest regulatory updates and internal policies, as they may be subject to change.","[{""document_id"":""7071751a-c3c4-4586-a41c-37da493416ad"",""chunk_content"":""You are strongly recommended to have life assurance in place to cover the full amount of all sums that you may borrow from us under the facility. Applications are subject \nto status and a minimum age ..."",""document_title"":""Unknown Document"",""confidence_score"":0.836267889595482},{""document_id"":""7071751a-c3c4-4586-a41c-37da493416ad"",""chunk_content"":""Condition & Charges:  A first charge over the property will be required as security for our mortgage. Full Personal Guarantees are required from all directors/ shareholders of a SPV \nLimited Company. ..."",""document_title"":""Unknown Document"",""confidence_score"":0.703334054450223},{""document_id"":""7071751a-c3c4-4586-a41c-37da493416ad"",""chunk_content"":""ificate completed less than 10 years prior to the submission of your \nmortgage application; or (b) a valid Predicted Energy Performance Certificate if the property build phase has not been completed \n..."",""document_title"":""Unknown Document"",""confidence_score"":0.687016306488273},{""document_id"":""7071751a-c3c4-4586-a41c-37da493416ad"",""chunk_content"":""ere the end of term date of the mortgage would be later than this for any applicant, applications may still be considered on an individual basis. Mortgages are \nnot available for business purposes.  \n..."",""document_title"":""Unknown Document"",""confidence_score"":0.682817799272806},{""document_id"":""7071751a-c3c4-4586-a41c-37da493416ad"",""chunk_content"":""ficate completed less than 10 years prior to the submission of your \nmortgage application; or (b) a valid Predicted Energy Performance Certificate if the property build phase has not been completed. \n..."",""document_title"":""Unknown Document"",""confidence_score"":0.673407416553411}]",2696,,2025-07-19 20:50:58.465
